Date,Headline,URL,Opening Text,Hit Sentence,Source,Influencer,Country,Subregion,Language,Reach,Desktop Reach,Mobile Reach,Twitter Social Echo,Facebook Social Echo,Reddit Social Echo,National Viewership,Engagement,AVE,Sentiment,Key Phrases,Input Name,Keywords,Twitter Authority,Tweet Id,Twitter Id,Twitter Client,Twitter Screen Name,User Profile Url,Twitter Bio,Twitter Followers,Twitter Following,Alternate Date Format,Time,State,City,Document Tags,ACT - Alps
22-Jun-2022 02:53PM,"Dans les Alpes, la neige en attente d’action climatique - L'Usine à Ges",https://usineages.fr/dans-les-alpes-la-neige-en-attente-daction-climatique/?idU=1&utm_source=newsletter_407&utm_medium=email&utm_campaign=la-lettre-quotidienne-de-lusin,,"Sur les sommets alpins, l’enneigement variera fortement selon la trajectoire d’émissions de gaz à effet de serre, révèle une étude publiée mardi 21 juin dans la revue Hydrology and Earth Sciences. Et si le pire n’est pas à exclure, l’éviter demeure possible. C’est un danger non seulement pour les écosystèmes…",L'Usine à Ges,,France,,French,214,214,0,0,0,0,0,,1.98,Negative,"action climatique,demeure possible,effet de serre,sommets alpins,émissions de gaz",ACT - Alps,,,,,,,,,,,"Jun 22, 2022",2:53 PM,,,"""ACT - Alps""",1
22-Jun-2022 06:00AM,Snow Cover in Alps Will Halve Without Climate Action - Emissions Cuts Can Save 80% of Snow Days,proquest:publicid-2679223676,"(TNSjou) -- The European Geosciences Union issued the following news release on June 21, 2022:The number of snow cover d",,Targeted News Service (Print Edition),,United States,Virginia,English,481,182,299,0,0,0,0,,4.45,Neutral,"European Geosciences Union,areas,cover,emissions,enough artificial snow,enough water,fight for water,following news release,further increase warming,greenhouse gas emissions,higher water flows,loss of snow,mountains,news,reductions in snow,snow,snow cover patterns,southern Alps,strong warming scenario,study,temperatures,warming,water availability,water usage,without-climate-action-emissions",ACT - Alps,,,,,,,,,,,"Jun 22, 2022",6:00 AM,Virginia,Springfield,"""ACT - Alps""",1
21-Jun-2022 12:00AM,Snow days in the Alps ‘will halve without faster action to stop climate change’,https://www.theusexpressnews.com/snow-days-in-the-alps-will-halve-without-faster-action-to-stop-climate-change/,"The number of snow days in the Alps will halve without faster action to stop climate change, a new study has warned.\n\nThe researchers said ...",,The Us Express News,Express News,United States,,English,482,482,0,0,0,0,0,,4.46,Neutral,"Italian Alps,Lead author Dr Michael Matiu,altitude,artificial snow,climate change,concerted action,emission reductions,example,faster action,further warming,glacier ice,glaciers on mountain,global warming,high altitude glaciers,lack of ice,last Ice Age,loss of snow,mountain winter sports,mountains,new study,northern Alpine countries,reductions in snow,several mountain ranges,ski lifts,ski resorts,ski slopes,snow,strong warming scenario,temperatures,temperatures, permafrost, glaciers and ice caps",ACT - Alps,,,,,,,,,,,"Jun 21, 2022",12:00 AM,,,"""ACT - Alps""",1
21-Jun-2022 04:40PM,\n                                                        高碳排放或使阿尔卑斯积雪减一半,https://news.sciencenet.cn/htmlnews/2022/6/481286.shtm,高碳排放或使阿尔卑斯积雪减一半\n\n\n\n一项研究认为，如果温室气体排放居高不下，到本世纪末，阿尔卑斯地区每年被积雪覆盖的天数可能会因为气温升高而减半，这将对可用水量、自然界及滑雪场产生严重影响。研究还指出，如果能迅速采取气候行动，83%的年积雪日将能得以保留。相关研究近日发表于《 ...,,科学网,冯丽妃  ,Mainland China,Beijing,Chinese Simplified,942,942,0,0,16,0,0,,8.71,Neutral,"严重影响,具体研究这个问题,排情况,相关研究,高碳排放",ACT - Alps,,,,,,,,,,,"Jun 21, 2022",4:40 PM,Beijing,,"""ACT - Alps""",1
23-Jun-2022 08:08AM,高碳排放或使阿尔卑斯积雪减一半,https://paper.sciencenet.cn/htmlpaper/2022/6/202262313134032173743.shtm,如果不减少排放，阿尔卑斯山南部的意大利、斯洛文尼亚和法国的部分地区积雪将严重减少，阿尔卑斯山西南部受到的影响尤其严重。积雪减少将对下游地区造成严重影响，这些地区依靠每年春夏融雪获得水资源。,,科学网,,Mainland China,Beijing,Chinese Simplified,942,942,0,0,0,0,0,,8.71,Neutral,"严重影响,具体研究这个问题,排情况,相关研究,高碳排放",ACT - Alps,,,,,,,,,,,"Jun 23, 2022",8:08 AM,Beijing,,"""ACT - Alps""",1
28-Jun-2022 11:32AM,高碳排放或使阿尔卑斯积雪减一半,https://paper.sciencenet.cn/htmlpaper/2022/6/202262313134032173743.shtm?id=73743,如果不减少排放，阿尔卑斯山南部的意大利、斯洛文尼亚和法国的部分地区积雪将严重减少，阿尔卑斯山西南部受到的影响尤其严重。积雪减少将对下游地区造成严重影响，这些地区依靠每年春夏融雪获得水资源。,,科学网,,Mainland China,Beijing,Chinese Simplified,942,942,0,0,0,0,0,,8.71,Neutral,"严重影响,具体研究这个问题,排情况,相关研究,高碳排放",ACT - Alps,,,,,,,,,,,"Jun 28, 2022",11:32 AM,Beijing,,"""ACT - Alps""",1
21-Jun-2022 12:00AM,France Snow days in the Alps ‘will HALVE without faster action to stop climate change’ #France,https://englishheadline.com/france-snow-days-in-the-alps-will-halve-without-faster-action-to-stop-climate-change-france/,"The number of days with snow cover in the Alps will halve without faster action to stop\n\nclimate change\n\n, a new study has warned. ...",,Englishheadline,written by englishheadline,United Kingdom,,English,1126,1126,0,1,0,0,0,,10.42,Neutral,"Italian Alps,Lead author Dr Michael Matiu,Northern Alpine countries,Ski resorts,access between ski,artificial snow,climate change,concerted action,emissions cuts,example,faster action,further warming,glacier ice,glaciers atop mountains,global warming,high-altitude glaciers,lack of ice,last ice age,loss of snow,new study,reductions in snow,resorts,snow,strong warming scenario,temperatures,temperatures, permafrost, glaciers and ice sheets",ACT - Alps,,,,,,,,,,,"Jun 21, 2022",12:00 AM,,,"""ACT - Alps""",1
21-Jun-2022 12:00AM,Snow days in the Alps 'will HALVE without faster action to stop climate change',https://www.businessmayor.com/snow-days-in-the-alps-will-halve-without-faster-action-to-stop-climate-change/,"The number of days with snow cover in the Alps will halve without faster action to stop\n\nclimate change\n\n, a new study has warned. ...",,Business Mayor,,United States,,English,1524,1524,0,0,0,0,0,,14.1,Neutral,"Italian Alps,Lead author Dr Michael Matiu,Northern Alpine countries,Ski resorts,access between ski,artificial snow,climate change,concerted action,emissions cuts,example,faster action,further warming,glacier ice,glaciers atop mountains,global warming,high-altitude glaciers,lack of ice,last ice age,loss of snow,mountains,new study,reductions in snow,resorts,several mountain ranges,snow,strong warming scenario,temperatures,temperatures, permafrost, glaciers and ice sheets",ACT - Alps,,,,,,,,,,,"Jun 21, 2022",12:00 AM,,,"""ACT - Alps""",1
22-Jun-2022 08:55AM,Raziskava: Število snežnih dni v Alpah bi se lahko do konca stoletja prepolovilo,http://znanost.sta.si/3050630/raziskava-stevilo-sneznih-dni-v-alpah-bi-se-lahko-do-konca-stoletja-prepolovilo,"Ljubljana/Rim/Pariz, 22. junija - Število dni s snežno odejo v Alpah bi se lahko ob visokih ravneh emisij toplogrednih plinov do konca ...",,STA znanost,,Slovenia,,Slovenian,2687,972,1715,1,0,0,0,,24.85,Not Rated,,ACT - Alps,,,,,,,,,,,"Jun 22, 2022",8:55 AM,,,"""ACT - Alps""",1
21-Jun-2022 12:00AM,Snow days in the Alps ‘will halve without faster action to stop climate change’,https://www.canadaexpressnews.com/snow-days-in-the-alps-will-halve-without-faster-action-to-stop-climate-change/,,,CANADA EXPRESS NEWS,,Canada,,English,4389,1881,2508,0,0,0,0,,40.6,Neutral,"Italian Alps,Lead author Dr Michael Matiu,altitude,artificial snow,climate change,concerted action,emission reductions,example,faster action,further warming,glacier ice,glaciers on mountain,global warming,high altitude glaciers,lack of ice,last Ice Age,loss of snow,mountain winter sports,mountains,new study,northern Alpine countries,reductions in snow,several mountain ranges,ski lifts,ski resorts,ski slopes,snow,strong warming scenario,temperatures,temperatures, permafrost, glaciers and ice caps",ACT - Alps,,,,,,,,,,,"Jun 21, 2022",12:00 AM,,,"""ACT - Alps""",1
21-Jun-2022 12:00AM,"Bad news for skiers: Snow days in the Alps will HALVE without faster action to stop climate change, experts warn",https://www.mailonsunday.co.uk/sciencetech/article-10934777/Snow-days-Alps-HALVE-without-faster-action-stop-climate-change.html,Alps snow days will halve without faster action to stop climate change - experts,,Mail On Sunday,Sam Tonkin,United Kingdom,South East and London,English,5081,1808,3273,0,0,0,0,,47,Neutral,"Italian Alps,Lead author Dr Michael Matiu,Northern Alpine countries,Olympian freestyle skier Philippe Marquis,Ski resorts,access between ski,altitude,artificial snow,climate change,concerted action,downstream water use,emissions cuts,energy and water,experts,faster action,further warming,global warming,high-altitude glaciers,loss of snow,lower elevations,new study,reductions in snow,resorts,skiing,skiing industry,snow,strong warming scenario",ACT - Alps,,,,,,,,,,,"Jun 21, 2022",12:00 AM,England,London,"""ACT - Alps""",1
21-Jun-2022 02:53PM,Deljena mnenja o uspešnosti dvotedenskih podnebnih pogajanj,https://www.energetika.net/novice/ekologija/deljena-mnenja-o-uspesnosti-dvotedenskih-podnebnih-pogajanj,,"V dvotedenskih pogajanjih na 56. zasedanju dveh pomožnih delovnih teles okvirne konvencije Združenih narodov o spremembi podnebja (UNFCCC) v Bonnu so pogodbenice na tehnični ravni dosegle napredek na skoraj vseh ključnih področjih, tj. na področjih blaženja podnebnih sprememb in prilagajanja nanje t",energetika.net,Valerija Hozjan,Slovenia,,Slovenian,6744,3288,3456,0,0,0,0,,62.38,Not Rated,,ACT - Alps,,,,,,,,,,,"Jun 21, 2022",2:53 PM,,,"""ACT - Alps""",1
22-Jun-2022 08:00AM,Raziskava: Število snežnih dni v Alpah bi se lahko do konca stoletja prepolovilo,https://krog.sta.si/3050630/raziskava-stevilo-sneznih-dni-v-alpah-bi-se-lahko-do-konca-stoletja-prepolovilo,"Ljubljana/Rim/Pariz, 22. junija - Število dni s snežno odejo v Alpah bi se lahko ob visokih ravneh emisij toplogrednih plinov do konca ...",,STAkrog,,Slovenia,,Slovenian,7321,2985,4336,0,0,0,0,,67.72,Not Rated,,ACT - Alps,,,,,,,,,,,"Jun 22, 2022",8:00 AM,,,"""ACT - Alps""",1
22-Jun-2022 10:22AM,(Raziskava znanstvene revije HES) Število snežnih dni v Alpah bi se lahko do konca stoletja prepolovilo – najbolj na udaru Italija in Slovenija,http://www.politikis.si/2022/06/raziskava-znanstvene-revije-hes-stevilo-sneznih-dni-v-alpah-bi-se-lahko-do-konca-stoletja-prepolovilo-najbolj-na-udaru-italija-in-slovenija/,"Število dni s snežno odejo v Alpah bi se lahko ob visokih ravneh emisij toplogrednih plinov do konca stoletja prepolovilo, v raziskavi, ...",,Politikis,Avtor: Urednistvo,Slovenia,,Slovenian,9618,3754,5864,0,0,0,0,,88.97,Not Rated,,ACT - Alps,,,,,,,,,,,"Jun 22, 2022",10:22 AM,,,"""ACT - Alps""",1
21-Jun-2022 12:13AM,Monday 20 June 2022 11:13 PM Snow days in the Alps 'will HALVE without faster action to stop climate change' trends now,https://en.mogaznews.com/Technology/1976818/Monday-20-June-2022-1113-PM-Snow-days-in-the-Alps-will-HALVE-without-faster-action-to-stop-climate-change-trends-now.html,Monday 20 June 2022 11:13 PM Snow days in the Alps 'will HALVE without faster action to stop climate change' trends now,,Mogaz News [EN],(dailymail),Egypt,,English,11154,4965,6189,0,0,0,0,,103.17,Neutral,"Italian Alps,american auto insurance,artificial snow,auto policy quote,climate change' trends,emissions cuts,faster action,further warming,instant car insurance quote,loss of snow,new study,reductions in snow,snow cover,southern Alpine countries,strong warming scenario,warming climate",ACT - Alps,,,,,,,,,,,"Jun 21, 2022",12:13 AM,,,"""ACT - Alps""",1
23-Jun-2022 06:02AM,Nur rascher Klimaschutz erhält Großteil der Alpen-Schneetage,https://www.msn.com/de-at/nachrichten/latest-news/nur-rascher-klimaschutz-erh%c3%a4lt-gro%c3%9fteil-der-alpen-schneetage/ar-AAYLrOf,Die in den vergangenen Jahrzehnten gestiegenen Durchschnittstemperaturen im Alpenraum sorgen schon heute vielerorts für weniger ...,,MSN Österreich,Redaktion k.at,Austria,,German,14302,4244,10058,0,0,0,0,,132.29,Negative,"Grad Celsius,Metern Seehöhe,Pariser Klimaziele,Richtung Ende,angepeilten Erwärmung,gestiegenen Durchschnittstemperaturen,rascher Klimaschutz,starken Erwärmung,vergangenen Jahrzehnten,östlichen Alpen",ACT - Alps,,,,,,,,,,,"Jun 23, 2022",6:02 AM,Vienna,Vienna,"""ACT - Alps""",1
23-Jun-2022 06:02AM,Nur rascher Klimaschutz erhält Großteil der Alpen-Schneetage,https://www.msn.com/de-at/nachrichten/other/nur-rascher-klimaschutz-erh%c3%a4lt-gro%c3%9fteil-der-alpen-schneetage/ar-AAYLrOf,Die in den vergangenen Jahrzehnten gestiegenen Durchschnittstemperaturen im Alpenraum sorgen schon heute vielerorts für weniger ...,,MSN Österreich,Redaktion k.at,Austria,,German,14302,4244,10058,0,0,0,0,,132.29,Negative,"Grad Celsius,Metern Seehöhe,Pariser Klimaziele,Richtung Ende,angepeilten Erwärmung,gestiegenen Durchschnittstemperaturen,rascher Klimaschutz,starken Erwärmung,vergangenen Jahrzehnten,östlichen Alpen",ACT - Alps,,,,,,,,,,,"Jun 23, 2022",6:02 AM,Vienna,Vienna,"""ACT - Alps""",1
23-Jun-2022 02:00AM,Seltener weiße Berge,http://at01.szarchiv.de/HH05/HH05.ashx?fu=arthtml&ugr=meltwater&uid=meltwater&pd=20220623&publ=SZ.SZ&id1=A114595462&id2=A114595462&sp=SZ,Bei weiterhin hohem Treibhausgas-Ausstoß wird künftig in den Alpen deutlich seltener Schnee liegen. Die fortschreitende Klimaerwärmung ...,,Süddeutsche Zeitung (Print Edition),DPA,Germany,,German,14597,11536,3061,0,0,0,0,,135.02,Negative,"Alpenraum –,Betroffene Regionen,Metern Höhe,Pariser Klimaziele,Tagen Schnee,Tiefere Lagen,deutlich seltener Schnee,ganzen Alpenraum,globalen Erwärmung,schlimmsten Fall –,starken Erwärmung,südlichen Alpen",ACT - Alps,,,,,,,,,,,"Jun 23, 2022",2:00 AM,,,"""ACT - Alps""",1
23-Jun-2022 09:01AM,Nur rascher Klimaschutz erhält Großteil der Schneetage in den Alpen,https://science.apa.at/power-search/5337820366025660999,Irgendwann einmal werden auch Schneekanonen nichts ausrichten können,,Science.apa.at,"Die in den vergangenen Jahrzehnten gestiegenen Durchschnittstemperaturen im Alpenraum sorgen schon heute vielerorts für weniger Schneesicherheit. Schwenkt die Welt nicht auf den Pfad der Begrenzung des Anstiegs im Sinne der Pariser Klimaziele ein, schmilzt der Anteil der Schneetage bis zum Ende des Jahrhunderts rapide dahin, wie Forscher aus Südtirol und Tirol berechneten. Besonders stark wäre der Schwund im Westen und Süden der Alpen, Österreich käme glimpflicher davon.",Austria,,German,24577,11218,13359,1,0,0,0,,227.34,Negative,"Grad Celsius,Metern Seehöhe,angepeilten Erwärmung,großer Veränderungen,höheren Lagen,niedrigen Lagen,rascher Klimaschutz,reichenden Alpenbogen,starken Erwärmung,veröffentlichte Untersuchung,östlichen Alpen",ACT - Alps,,,,,,,,,,,"Jun 23, 2022",9:01 AM,,,"""ACT - Alps""",1
22-Jun-2022 08:52AM,Število snežnih dni v Alpah se dramatično zmanjšuje,https://moski.hudo.com/lifestyle/potovanja/stevilo-sneznih-dni-v-alpah-se-dramaticno-zmanjsuje/,"Število dni s snežno odejo v Alpah bi se lahko ob visokih ravneh emisij toplogrednih plinov do konca stoletja prepolovilo, v raziskavi, ...",,Moški.si - Hudo.com,A. P. / STA,Slovenia,,Slovenian,29492,8566,20926,0,0,0,0,,272.8,Not Rated,,ACT - Alps,,,,,,,,,,,"Jun 22, 2022",8:52 AM,,,"""ACT - Alps""",1
21-Jun-2022 12:00AM,Snow days in the Alps ‘will halve without faster action to stop climate change’,https://www.uktimenews.com/snow-days-in-the-alps-will-halve-without-faster-action-to-stop-climate-change/,"The number of snow days in the Alps will halve without faster action to stop climate change, a new study has warned.\n\nThe researchers said ...",,UK time News,,United Kingdom,,English,32665,6390,26275,0,0,0,0,,302.15,Neutral,"Italian Alps,Lead author Dr Michael Matiu,altitude,artificial snow,climate change,concerted action,emission reductions,example,faster action,further warming,glacier ice,glaciers on mountain,global warming,high altitude glaciers,lack of ice,last ice age,loss of snow,mountain winter sports,mountains,new study,northern Alpine countries,reductions in snow,several mountain ranges,ski lifts,ski resorts,ski slopes,snow,strong warming scenario,temperatures,temperatures, permafrost, glaciers and ice caps",ACT - Alps,,,,,,,,,,,"Jun 21, 2022",12:00 AM,,,"""ACT - Alps""",1
21-Jun-2022 01:01AM,Study: Alps could lose half its 'snow days' by end of the century,https://www.businessgreen.com/news/4051538/study-alps-lose-half-snow-days-end-century,Changing climate threatens both winter sports industry and water availability across Europe,,Business Green,Tom Gockelen-Kozlowski,United Kingdom,,English,52193,21899,30294,20,1,0,0,,482.79,Negative,"areas,century,climate action,emissions,emissions in line,energy production,fight for water,greenhouse gas emissions,high energy,high levels,higher water flows,loss of snow,number,potentially catastrophic levels,rapid emissions cuts,reductions in snow,significant climate impacts,snow cover,southern Alps,strong warming scenario,study,warming,water,water availability,winter,winter sports fans",ACT - Alps,,,,,,,,,,,"Jun 21, 2022",1:01 AM,England,London,"""ACT - Alps""",1
21-Jun-2022 02:51PM,Study: Alps could lose half its 'snow days' by end of the century,https://www.businessgreen.com/news/4051538/study-alps-lose-half-snow-days-end-century,,Changing climate threatens both winter sports industry and water availability across Europe,Business Green,Tom Gockelen-Kozlowski,United Kingdom,,English,52193,21899,30294,20,1,0,0,,482.79,Negative,"century,climate,winter sports industry and water availability",ACT - Alps,,,,,,,,,,,"Jun 21, 2022",2:51 PM,,,"""ACT - Alps""",1
22-Jun-2022 05:53PM,"Forschende: Künftig seltener weiße Berge in Italien, Frankreich und Co.",https://www.ejz.de/blick-in-die-welt/wissen/forschende-kuenftig-seltener-weisse-berge-in-italien-frankreich-und-co_245_112170048-122-.html,"22.06.2022 - VON RND\n\nSchnee gehört zu den Alpen dazu. Doch je wärmer die Erde wird, desto seltener sind die Täler und Hänge weiß. Noch ...",,Elbe-Jeetzel-Zeitung,22.06.2022 - VON RND,Germany,Niedersachsen,German,69725,7642,62083,0,0,0,0,,644.96,Negative,"Betroffene Regionen,Jahre Schnee,Metern Höhe,Pariser Klimaziele,Tagen Schnee,deutlich seltener Schnee,ganzen Alpenraum,globalen Erwärmung,neue RND,schlimmsten angenommenen Fall,starken Erwärmung,südlichen Alpen",ACT - Alps,,,,,,,,,,,"Jun 22, 2022",5:53 PM,Lower Saxony,Lüchow,"""ACT - Alps""",1
22-Jun-2022 02:51PM,STA: Raziskava: Število snežnih dni v Alpah bi se lahko do konca stoletja prepolovilo\n    ,https://www.sta.si/3050630/raziskava-stevilo-sneznih-dni-v-alpah-bi-se-lahko-do-konca-stoletja-prepolovilo?q=alp,,"Število dni s snežno odejo v Alpah bi se lahko ob visokih ravneh emisij toplogrednih plinov do konca stoletja prepolovilo, v raziskavi, objavljeni v znanstveni reviji Hydrology and Earth Sciences, ugotavlja European Climate Foundation. Brez ukrepanja bo izguba snega še posebej huda v Italiji, Sloveniji in v nekaterih delih Francije.",sta.si,,Slovenia,,Slovenian,82714,31376,51338,0,0,0,0,,765.1,Not Rated,,ACT - Alps,,,,,,,,,,,"Jun 22, 2022",2:51 PM,,,"""ACT - Alps""",1
22-Jun-2022 12:08AM,Press release Snow cover in the Alps will halve without climate action – emissions cuts can save 80% of snow days,https://www.egu.eu/news/914/snow-cover-in-the-alps-will-halve-without-climate-action-emissions-cuts-can-save-80-of-snow-days/,Snow cover in the Alps will halve without climate action – emissions cuts can save 80% of snow days,,European Geoscience Union,,Germany,,English,87481,39438,48043,0,1,0,0,,809.2,Neutral,"Press release Snow cover,association of scientists,climate action,cover,emissions cuts,energy production,enough artificial snow,enough water,fight for water,greenhouse gas emissions,high energy,higher water flows,loss of snow,mountains,number,reductions in snow,scientists,snow,southern Alps,strong warming scenario,study,warming,water availability,water usage",ACT - Alps,,,,,,,,,,,"Jun 22, 2022",12:08 AM,,,"""ACT - Alps""",1
21-Jun-2022 12:00AM,Snow days in the Alps ‘will halve without faster action to stop climate change’,https://www.thebharatexpressnews.com/snow-days-in-the-alps-will-halve-without-faster-action-to-stop-climate-change/,"The number of snow days in the Alps will halve without faster action to stop climate change, a new study has warned.",,The Bharat Express News,Bharat Express News,India,,English,96591,25617,70974,0,0,0,0,,893.47,Neutral,"Italian Alps,Lead author Dr Michael Matiu,altitude,artificial snow,climate change,concerted action,emission reductions,example,faster action,further warming,glacier ice,glaciers on mountain,global warming,high altitude glaciers,lack of ice,last ice age,loss of snow,mountain winter sports,mountains,new study,northern Alpine countries,number,reductions in snow,several mountain ranges,ski lifts,ski resorts,ski slopes,snow,strong warming scenario,temperatures,temperatures, permafrost, glaciers and ice caps",ACT - Alps,,,,,,,,,,,"Jun 21, 2022",12:00 AM,,,"""ACT - Alps""",1
23-Jun-2022 09:59AM,Nur rascher Klimaschutz erhält Großteil der Schneetage in Alpen,https://volksblatt.at/nur-rascher-klimaschutz-erhaelt-grossteil-der-schneetage-in-alpen/,Die in den vergangenen Jahrzehnten gestiegenen Durchschnittstemperaturen im Alpenraum sorgen schon heute vielerorts für weniger ...,,Neues Volksblatt,,Austria,,German,101996,10754,91242,0,0,0,0,,943.46,Negative,"Grad Celsius,Metern Seehöhe,Pariser Klimaziele,Richtung Ende,angepeilten Erwärmung,gestiegenen Durchschnittstemperaturen,rascher Klimaschutz,starken Erwärmung,vergangenen Jahrzehnten,östlichen Alpen",ACT - Alps,,,,,,,,,,,"Jun 23, 2022",9:59 AM,Upper Austria,Linz,"""ACT - Alps""",1
21-Jun-2022 02:51PM,Quelle neige restera-t-il dans les Alpes en 2100 ?,https://www.montagnes-magazine.com/actus-quelle-neige-restera-il-les-alpes-2100,,"Selon le scénario climatique choisi, les conséquences en termes de couverture neigeuse dans les Alpes d'ici à la fin du siècle ne sont pas ...",Montagnes Magazine,Mathias Virilli,France,,French,129314,41731,87583,6,84,0,0,,1196.15,Neutral,"scénario climatique,termes de couverture neigeuse",ACT - Alps,,,,,,,,,,,"Jun 21, 2022",2:51 PM,,,"""ACT - Alps""",1
22-Jun-2022 05:46PM,"Forschende: Künftig seltener weiße Berge in Italien, Frankreich und Co. ",https://www.dnn.de/wissen/forschende-kuenftig-seltener-weisse-berge-in-italien-frankreich-und-co-33LM3LXVTZGHFND5J2QXRBSMHM.html,"Schnee gehört zu den Alpen dazu. Doch je wärmer die Erde wird, desto seltener sind die Täler und Hänge weiß. Noch gibt es Spielraum, wie ...",,Dresdner Neueste Nachrichten (DNN),,Germany,Sachsen,German,144456,49064,95392,0,0,0,0,,1336.22,Negative,"Betroffene Regionen,Jahre Schnee,Metern Höhe,Tagen Schnee,deutlich seltener Schnee,ganzen Alpenraum,globalen Erwärmung,italienischen Bozen,schlimmsten angenommenen Fall,starken Erwärmung,südlichen Alpen",ACT - Alps,,,,,,,,,,,"Jun 22, 2022",5:46 PM,Saxony,Dresden,"""ACT - Alps""",1
22-Jun-2022 10:28AM,Število snežnih dni v Alpah bi se lahko do konca stoletja prepolovilo,https://maribor24.si/globalno/stevilo-sneznih-dni-v-alpah-bi-se-lahko-do-konca-stoletja-prepolovilo,"Brez ukrepanja bo izguba snega še posebej huda v Italiji, Sloveniji in v nekaterih delih Francije.",,Maribor24.si,Uredništvo,Slovenia,,Slovenian,158646,44396,114250,0,0,0,0,,1467.48,Not Rated,,ACT - Alps,,,,,,,,,,,"Jun 22, 2022",10:28 AM,,,"""ACT - Alps""",1
22-Jun-2022 02:00AM,Künftig seltener weiße Berge,http://at01.szarchiv.de/HH05/HH05.ashx?fu=arthtml&ugr=meltwater&uid=meltwater&pd=20220622&publ=SZ.SDE&id1=A115365615&id2=A115365615&sp=SDE,"Schnee gehört zu den Alpen dazu. Doch je wärmer die Erde wird, desto seltener sind die Täler und Hänge weiß. Noch gibt es Spielraum, wie ...",,Sueddeutsche.de (online exclusive),,Germany,,German,162014,4744,157270,0,0,0,0,,1498.63,Negative,"Betroffene Regionen,Metern Höhe,Pariser Klimaziele,Tagen Schnee,Tiefere Lagen,deutlich seltener Schnee,drastische Auswirkungen,ganzen Alpenraum,globalen Erwärmung,schlimmsten angenommenen Fall,starken Erwärmung,südlichen Alpen",ACT - Alps,,,,,,,,,,,"Jun 22, 2022",2:00 AM,,,"""ACT - Alps""",1
22-Jun-2022 06:08PM,"Forschende: Künftig seltener weiße Berge in Italien, Frankreich und Co.                         ",https://www.op-marburg.de/Mehr/Welt/Wissen/Treibhauseffekt-Sind-weisse-Berge-in-Italien-Frankreich-und-Co.-bald-Geschichte,"\n                                        Schnee gehört zu den Alpen dazu. Doch je wärmer die Erde wird, desto seltener sind die Täler und ...",,Oberhessische Presse,,Germany,Hessen,German,175633,43361,132272,0,0,0,0,,1624.61,Negative,"Betroffene Regionen,Jahre Schnee,Künftig seltener weiße Berge,Metern Höhe,Pariser Klimaziele,Tagen Schnee,deutlich seltener Schnee,ganzen Alpenraum,globalen Erwärmung,italienischen Bozen,schlimmsten angenommenen Fall,starken Erwärmung,südlichen Alpen",ACT - Alps,,,,,,,,,,,"Jun 22, 2022",6:08 PM,Hesse,Marburg an der Lahn,"""ACT - Alps""",1
